{"adapter_id":"solver-no-calculus","canonical_writes":0,"created_utc":"2026-07-28T00:00:00Z","engine_execution":"completed","exercise_level":"actual_compute","grants_authority":false,"output_object_ids":["sha256:2222222222222222222222222222222222222222222222222222222222222222"],"pack_ref":{"digest":"sha256:aaaaaaaaaaaaaaaaaaaaaaaaaaaaaaaaaaaaaaaaaaaaaaaaaaaaaaaaaaaaaaaa","media_type":"application/vnd.srlab.adapter-pack+json","schema_version":"ArtifactRef/v1","size_bytes":4096},"receipt_id":"sha256:5883ff204dc2c5f9a5168106703b5c6da11476e5130907e8efa87de46acf1b73","rss_bytes":1048576,"run_request_id":"sha256:1111111111111111111111111111111111111111111111111111111111111111","schema_version":"ScienceLabEngineReceipt/v1","wall_seconds":42}
